{
  "repo": "acme-group/platform/backend",
  "entity": {
    "kind": "change_proposal",
    "id": 42,
    "url": "https://gitlab.com/acme-group/platform/backend/-/merge_requests/42"
  },
  "transition": {
    "kind": "merged"
  },
  "actor": {
    "id": "maintainer-user",
    "kind": "human",
    "role": "maintain",
    "bot_role": null,
    "is_entity_author": false
  },
  "state": {
    "labels": ["fullsend-review"],
    "change_proposal": {
      "id": 42,
      "head_repo": "acme-group/platform/backend",
      "base_repo": "acme-group/platform/backend",
      "head_ref": "feature/add-logging",
      "base_ref": "main",
      "head_sha": "cccccccccccccccccccccccccccccccccccccccc",
      "author_id": "dev-user",
      "is_fork": false
    }
  },
  "source": {
    "system": "gitlab",
    "raw_type": "merge_request",
    "raw_action": "merged"
  }
}
